,comment_id,body,score
2537,cybbvwk,think s dumb honestly d like know reason nt one nt feel like defending claim make comment besides cool contrarian ,0.271
2538,cybcdo9,suppose m pointing re also part circle jerk pc like accomplishes anything besides tumblr sites thinking re cool ,0.25
2539,cybcick, said reason dumb postmodern example anita s everything sexist statement leads us logical conclusion exists solely excuse justify value point sort like digital currency latter least adheres certain axiom less bitcoin bitcoin ,0.574
2540,cybcjsk,being pc circlejerk s polite generally thoughtful others s suggesting pointing re dicks igthft making target offensive jokes ,0.417
2542,cybd0qy,m women s studies major know enough field know s accurate characterization programs field study general think pointing instances sexbased difference society way formulate knowledge worthwhile activity ,0.104
2543,cybda3f,wow sounds like nt taken philosophy classes well taking women s studies classes haha ve said untrue re misusing lot terms ,0.104
2544,cybdhpn,point terms misusing otherwise sounds like empty bluster ,-0.022
2545,cybf1vr,hilarious sad dont understand womens struggles history behind gws classes ,-0.104
2546,cybfuyk,honestly nt see bother s clear ve put effort part towards studying things comment would make would fall deaf ears actually subject re interested learning plenty books resources start,0.021
2547,cybgrqj,woman s studies pretty ridiculous field ,0.146
2548,cybi7f6,read like foghat wearing shit ,0.5
2549,cybkic6,yeah courteous without outwardly state time people know re good person s m getting ,-0.104
2550,cybkqb6,nt total dickbag people funny ,0.5
2551,cybkyp0,yeah get s subreddit one going hell making fun mother s cooking re missing point subreddit nt even worst shit ve posted s making fun someone s degree choice people time ,0.167
2552,cybl1qx,point sub nt even try witty clever posts people reiterating stereotypes quoting things people find offensive ,-0.106
2553,cyblc8i,relate original comment ,-0.292
2554,cybtwab,anything fact lot cbers say used right wing sub ,-0.271
2555,cybunta,nah cb used lean conservative reactionary racist sexist etc ,0.085
2556,cyc2ggf, tell m really stem follow fucking love science facebook wait s somebody posted article scientific paper reddit somebody else pointed author nt perfectly translate nonprofessionals omfg stupid bullshit nonstem journalists popscience click bait ,0.667
2558,cydjlq3,well understand people read offensive dark humor sub nominally occasionally problem sub days least much dae hate feministsblack people barely joke added ,0.375
2559,cydjqog,hell talking think gender studies degrees university anita sarkesian tumblr posts something appear get knowledge gender studies consists second hand reddit ,0.396
2560,cye0k4e,really enjoyed format type indepth discussion topic deserves happy answer questionscomments anything said ,-0.438
2561,cye0qoq,excited new show ve yet watched probably wo nt get till tomorrow nt want pass much judgement watching fear getting two new owners backed angelsvc friend uesportslaw represent teams might objective stance ps like observation ,-0.277
2562,cye10ac,worry well s somewhat clear early three represent spectrum opinions noah almost wholeheartedly releasing salaries probably least part immortals new vcbacked company noah s better nothing seems like nothing alternative bryce also clearly favors publicized player salaries approaching practicalexperienced look salary information drop bucket information players really need properly evaluate marty seems staunchly release player salaries sees skewed noncontextual inflammatory value might provide players need information balanced opinions actually work pretty well s especially interesting seeing different marty noah s opinions ,-0.042
2563,cye1k0d,utmost respect bryce noah know well nt know marty well brief interactions also respect opinion m advocating broader representation parties late piece obviously s food thought whichever topic duncan looks tackle next ,-0.489
2564,cye1mzz,yeah next time let s get former player law student pro game caster turned team owner get thorin ,-0.312
2565,cye1yw5,talk issue depth s definitely worth listen stance whole topic re better served long sometimes tough conversation boiling important complex topic said summarize d say publicizing salaries giving players information teams push back information used vice versa always going risk data misused nt think justifies withholding information ,-0.25
2567,cye66ue,thanks ll go back time m invited really enjoyed time show good conversation really smart people topics fascinate wish ,-0.354
2568,cye6dok,thank much means lot sometimes take beating decisions perspectives still think correct others might differently opportunity end day m person trying best help industry grow kind words like especially someone critical past helps keep going ,-0.304
2569,cye72jt,hey wanted say really enjoyed show guys great articulating points s honestly astounding even explain vc money nt endless faucet investors actually spend money intelligently would enjoyed seeing thoughts chinese scene regarding though p,-0.085
2570,cyegocw,hey question poaching player initiates contact organization contract expires rules apply know quite cases organizations initiated punished work player initiating ,-0.188
2571,cyek4d5,holy shit ve enjoying esports many years learned much never even thought money mind blown informative fuck discussion ,0.396
2572,cyen01u,awesome conent perhaps ya get vc guys rick fox steve seems profiecient team marketing,-0.383
2573,cyen698,fuck random guys ,0.688
2574,cyenf91,player punished see bjerg season ,-0.417
2575,cyenjrf,fucking quality content really great hear eloquent discussion topic ca nt say able contextualise american sports references interesting nonetheless hope see format hope owners step forwarall glory alphadraft,0.604
2576,cyeo0s2,nt addressing question question questioning relationship player reaching organization another player,0.022
2577,cyep4hg,honest train thought new scary watch something new guests talkative made quite easy watch stake debate nt care still interesting listen perhaps strange s case ,-0.25
2578,cyeq1gf,talk freemarket system reasonable consistent real american values got ta feel older brands might eventually get pushed lot big names league tsm clg tl dig combined could never hope match real venture capitalist money d hate see teams ve spent time watching died jerry jones wanted lcs team ,0.125
2579,cyer03o,really liked kind discussion format great vid ,-0.625
2580,cyere16,awesome series hope continues needs better name imo ,-0.542
2581,cyerfmd,think chinese scene distorted views vc bit ,-0.104
2582,cyerouq,amazing ep love series panelists absolutely crushed topic thorin great job hitting pointscounterpoints really like splyce immortals owners ,-0.426
2583,cyesvzb,quality content always thorin ,-0.562
2584,cyet6pt,entered chinese scene nt vc though s literally pet projects rich kids vcs investors pitch business plan theyll give moneydebtdistribution exchange equityboard seats like idea ,-0.062
2585,cyetwbg,nt get,-0.438
2586,cyeumsd,time new hypothetical team lazari,-0.312
2587,cyevhf1,kind education reddit needs please interested topic discussion must watch ,-0.292
2588,cyevwkc,omg noisy ass nose breathing much bare usually watch thorins vids shut one cos lazerchicken dude ,0.229
2589,cyewje8,likely depends action org takes player penalozed trying breach contract org knowingly would well ,-0.104
2592,cyezh38,s quality content may give shit sides actual meaning discussion content interesting enough watch listen learn ,0.188
2594,cyfehmq,true enough certainly might make people suspicious new orgs big money ,-0.34
2595,cyfgged,guys comparing esports viewership surfing think important caveat might left s probably substantial portion esports viewership unlikely purchase products lack surplus income nt know larger audience surely s relevant esports viewers demographics atypical spending compared surfing viewers extreme sports viewers could one reason esports fails get type sponsors sports nt think ,-0.188
2596,cyfh6qp,ah yes renowned women s studies professor anita sarkeesian ,-0.333
2597,d2u07ry,still find hilarious luffy s care free attitude took sanji vital sh s survival ,-0.042
2598,d2u2jwy,rip yuki carrot theory yuki yuki mi revived nami s tangerines someone going eat would happened starving ,-0.188
2599,d2ulr71,sanji s brother nt immediately hit namischwan ll upset,-0.25
2600,d2um1h6,noticed sanji s eyebrow opposite brother s ,-0.417
2601,d2umqr3,well likely filthy rich ,-0.043
2602,d2urx2h,bomb instead blows vinsmokes ,-0.062
2603,d2uurp1,know would nt suprised sanji cut ties family kept fighting girls ,-0.239
2604,d2uzifp,baseless theory time sanji bastard child reverse curl eyebrows proof vinsmokes remain secret tortured killed mother trying find witnessed mother s sacrifice turn led never hurt lady motto ,0.128
2605,d2v38nl,personally think wo nt revealed falls water pedro says something like nt worry s excellent swimmer bubble bubble umm ,-0.167
2606,d2v49sj,chapter ,-0.688
2607,d2vhkhv,part mafia ,-0.188
2609,d2vvufg,random theory vinsmokes germa associates one killed brook rumbar pirates brrok nt want talk s hard think,0.083
2610,d2vxog3,year since started anime finally caught manga least latest arc looks really fun far ,-0.479
2611,d2vzim3,luffy poisoned clearly set poison resistance big mom also go along monet devil fruit theories think best timing big moms crazy cotton candy rain ll less noticeable one tangerines turned devil fruit setting perfectly carrot nami,-0.229
2612,d2w63xj,may onto something ,-0.787
2613,d2w7g6m,nt know much swimming experience unless pools zou,-0.375
2614,d2w7nsy,think guy end fall love nami lol,-0.478
2615,d2wg8mp,else think luffy attack ship food ,-0.25
2616,d2wynjx,hope look like zoro green hair end mixup turns real name vinsmoke roronoa zoro ,-0.191
2617,d2wzgoy,people think luffy seriously hurt s probably comically injured would get back problem fight,-0.333
2618,d3l5997,s nightmare environment climate change ,-0.021
2619,d3lerrz,maybe obama nt bypassed congress paris climate treaty ,-0.062
2620,d3lfneg,course would d also end obamacare taking affordable healthcare away nearly twenty million people d also best ban abortions d also bomb iran d also oh hell nt vote fucker alright ,0.479
2621,d3lgdau,hired clintons say inflamatory shit possible boost chances bernie people cave vote lesser evil say fuck eye ,0.792
2622,d3lgl4a,bybassing shitty worthless nothing congress run reactionaries shame ,0.562
2623,d3lhg4f,ll ok trump gets elected bypasses congress ,0.062
2624,d3li9fo,wo nt abuse power pass climate change treaties reclassify co criteria pollutant without required congressional approval ,0.042
2626,d3liqao,m thought little picture drew carey sitting whose line anyway desk ,-0.292
2627,d3livkq, d also end obamacare replace obamacare ,-0.188
2628,d3lixts, welcome american politics ,-0.417
2630,d3lj4og, bitch slap us existence im using,0.5
2631,d3ljnud, simple truth s nothing simple many complicating factors including way money corporations influence lawmakers way gerrymandering affects citizens us actually get elect congresspeople way media outlets use influence shape citizens understanding dangers climate change way people tend weigh shortterm concerns longterm concerns etc nt simple truth nt simple topic living kind pure utopian democracy every single action congress government general direct citizens s simple ,-0.065
2632,d3ll4tx,m waiting environment climate change become nightmares money keeps mind blindfolded reality world ,-0.167
2633,d3llun8,really boggles mind trump international beach resort one trump towers miami areas likely hit worst rising sea level course ll probably bankrupt business walk away money like normally ,0.0
2634,d3lm7tn, trump supporters climate change deniers lol,0.021
2635,d3lne76,dumph following republican drive dismantle government small enough drown bathtub republicans like ,0.167
2636,d3lnvrj,truly staggering foolhardiness way trump others like learn reckless ignorance would earn without condemning rest world ,0.064
2637,d3lp89u,hillary really loving choices ,0.062
2638,d3lqqqo,ha ha ha nt care corporations democrats voters ,0.0
2639,d3lr186,promoting fracking taking millions big oil saudis fucking joke ,0.875
2640,d3lslio, bitch slap us existence continue current trajectory already changing trajectory big pushes solar renewables already climate treaty market forces china s need something air pollution ,0.646
2641,d3lszjy,nebraskans stubborn told go pound sand ,-0.022
2642,d3lu210,political views need cast aside put climate change denier presidency screwed ,-0.234
2645,d3lw49l,typical money obsessed prick nt care planet live ,0.292
2646,d3lwdwt,oh man s great idea nuke large cities us send economy sky ,0.104
2647,d3m0uvd,nt forget vaccines cause autism torture awesome murder families terrorists ,0.5
2648,d3m205i,yeah m constantly questioning ridiculous enough opinion people laugh instead saying fuck ,0.583
2649,d3m2p9q,ve long enough realize opinion ridiculous enough unbelievable ,-0.208
2650,d3m33vc,s sad s true ,-0.458
2651,d3p4uqf,shit saw hand brother going appear nowhere punch ,0.479
2652,d3p5dot,anyone else see sex toy ,0.062
2653,d3p5mpv,people s right arm would annoy crap,-0.25
2654,d3p5tbi,needs sold penis shaped ottoman make international sign boning furniture ,0.104
2655,d3pcnp0,yeah looks kinky fuck also looks like thoroughly abused ,0.625
2656,d3pcyxi,spotted german hand sign means arsehole german language area ,0.292
2657,d3pitkz,hmm never heard though grow family tried best german rather modern ,-0.196
2658,d3plr5f,m guessing purchased leftorium ,-0.391
2659,d3pmig2, shocker would pretty scary,-0.229
2660,d3pmix8,s girlfriend s favorite chair ,-0.812
2661,d3pojn7,need tchktchk chair ,-0.271
2662,d3powck,cafe nervosa real ve ever seen one frasier ,-0.208
2663,d3poxn4,chairs sick one got uncomfortable shit though ,0.0
2664,d3pq2nc,quick need giant spliff ,-0.208
2665,d3pqr9x,d want even number right left handed chairs room appropriately placed would bother forever ,-0.191
2666,d3psept,chair click click ,-0.333
2667,d3puzbf,s rip one ,-0.522
2668,d3pw2z3,d roll biggest doobies things hold pillows doobie pillows ,0.146
2669,d3pwpqv,eh chairs okay ,-0.562
2670,d3q074m,m hours late make comment close ,-0.5
2671,d3q5qmu,s kinda chair ,-0.708
2673,d3q5ydp,everywhere especially kids make arsehole sign someone looks punch ,0.333
2675,d4jfsl2,perfectly reasonable care people embarrassment eu friends like laying threats needs enemies ,-0.042
2676,d4jgk2b,france scared shitless s pretty entertaining watch yankee ,0.404
2677,d4jign5,bulgaria croatia czech republic denmark hungary poland romania sweden united kingdom eu members use euro bulgaria croatia cyprus ireland romania united kingdom outside schengen bulgaria croatia romania also deal outside euro schengen nt optouts two things countries nt ,-0.146
2678,d4jih7o,makes say asking frenchman currently living france m bit worried gbp savings m working uk france getting paid gbps moment general sentiment overall indifference people around think uk suffer economically brexit fine eventually could chance eu ,-0.042
2679,d4jivpv,absolute twaddle threats get grip ve got sweetest deal anyone union asked nt get everything want turn around say s ignoring people s like upper management asking board benefits neither commensurate position fair anyone else company talking family s needs rightly denied ,0.479
2680,d4jjbiz, bulgaria croatia czech republic denmark hungary poland romania sweden united kingdom eu members use euro denmark uk required treaty move towards usage euro bulgaria croatia cyprus ireland romania united kingdom outside schengen ireland united kingdom nt required treaty work towards joining schengen joining schengen ready definitely deal uk edit neither would uk left rejoined ,-0.292
2681,d4jjn3y, asked nt get everything want exactly ca nt get want stay europe solution leave ,-0.239
2682,d4jl740,well federalisation big word yeah d like democratic eu means integration also nt want ttip s one reason let uk go still think eu lot gain british culture political otherwise ,-0.104
2683,d4jr75z,sweetest deal get charged billions year countries protect inefficient industries blocking trade deals historic allies ,-0.146
2684,d4jrwp4,ah old trade deals trope tell countries level trade integration anywhere earth less integration less growth s negatives leaving dire even fta option comes huge negatives eu single market economic holy grail trade agreements nowhere else earth integrated trade s essentially moving eu bloc towards single entity far trade concerned ie one country still allowing constituent countries retain ultimate sovereignty control important policy issues ,0.109
2685,d4jry0x,cemented today listening bellowing scottish remainer woman last night promising d reform fix eu actually gave hope know d try allowed eu ironically honest remainers empty promises getting anymore changes eu ve made clear nt like know tomorrow ,0.104
2686,d4jtleh,re already third powerful member state voting power council parliament leave precisely zero say eu run ,-0.021
2687,d4jtt3f,two front us almost always us form coalitions us european integration always french german idea never interests minds ,-0.062
2688,d4juky4,factually wrong growth eu beaten many countries around world pointless response ,0.188
2689,d4jusbv,nt think maybe eu expended fast far east s become big diverse think ,0.021
2690,d4juwu0,eu nt country country would much economically efficient eu bloc since barriers trade america successful instance aim eu project reduceremove barriers operate one unit gain economic benefits still retaining sovereignty said ,-0.125
2691,d4jxs5f,happens one part world often affect things parts see example current syria migrant crisis us subprime mortgage crisis second world war ,-0.167
2692,d4jy4ky,many fault eu would leaving eu affect ability talk countries us eu prevent migrant crisis economic crash crisis last odd years kind answer question would need want say something run nt part ,-0.125
2693,d4jyler,sometimes things happen places affect us sometimes good idea say places run things nt case bother countries governments first place would need say nextdoor neighbour things ,-0.25
2694,d4k0eg1,growth normally looked percentage terms fairly meaningless comparing countries start vastly different levels growth india pretty poor whereas growth us lot terms affects country ,-0.292
2695,d4k0skq,mean like rest world trades us rest eu nt say us policy made chinese country manage trade fine everyone knows basic principles involved conform standards market selling concede valid reason stay average person street someone basing concerns trade say regulations would nt overriding concern ,-0.042
2697,d4k34rw,way misinterpret said s saying vote leave wo nt come back better offer ,0.021
2698,d4k3nm1,lot people must misinterpreting given number credible articles said undermines cameron s view eve vote d able strike better deals uk d done earlier year ve clearly stated got feb limit period give us anything else special exception nt even feel gave us feb fair words maximum concession ,-0.125
2699,d4kixry,feel like nt read past first line ,-0.261
2700,d4kk2as,well perspective gave us nt fair already exemptions every major eu ideal euor schengen etc fuck british people think special different rules ,0.396
2701,d4kkxoh,even nt like eu works see point ca nt expect everyone follow rules yet one country keep asking special passes suit ,-0.042
2702,d4kkzd8,exactly believe actually embraced europe taken interest would problems eu today refuse actually play rules always outsider however show important europe much influence possess brussels,-0.042
2703,d4kmcls,well yes seeing uk tends lead way reforms eu nt see reason ca nt happen near future,-0.333
2704,d6gw7t9,didnt play series played tiebreaker game,-0.375
2705,d6gwhdz,yea d risk another tie,-0.396
2706,d6gwqwf,sure hell love ties europe ,-0.087
2707,d6gwuvt,also min talk game live facebook think starts min games ,-0.292
2708,d6gxbq0, teams would get preferred side additional game recreating bo issue,-0.229
2709,d6gxs43, min talk game starts minute game legit,-0.375
2710,d6gyiu6,well nt say s min talk wo nt talk game begins stop around min game prepare least happened last time,-0.229
2711,d6h2gd7,see ,-0.688
2712,d6h4q7w,another eu technical issue nt time c,-0.062
2713,d6h53fb,forgiven packing stuff army series lets go rekkincrew,-0.217
2714,d6h54s7,delay makes even hyped p,-0.625
2715,d6h5onz,s delay ,-0.596
2716,d6h5pg1,eu s version hype minute technical delay lul,-0.333
2717,d6h60bk,way kill hype technical issues every week ,0.021
2719,d6h6ity,dude serious note someone messing shit fnc plays almost every game play right delayed problem probably freeze using russian spy skills fuck fnc ,0.792
2720,d6h6k03,hyyype hour passed still pickban phase hyyyyyyyyyyyyyyyyyyyyyppe ,0.0
2721,d6h6pvv,hype dead already roll dice let s move tl vs clg already ,-0.125
2722,d6h6v91,maybe leave game ended pausing intensifies ,-0.188
2723,d6h6xxr,dislikes significantly going,-0.196
2724,d6h7dgf,s causing delay ,-0.625
2725,d6h7dst,lol absolutely delay,-0.562
2726,d6h7g1l,s sad say think finally year yellowstar misses worlds rip record,-0.521
2727,d6h7hpp,bright side least re playing ekko remix second break ,-0.458
2728,d6h8eyd,forgven fall like playoffs rekkles forgve ys ,-0.208
2729,d6h8tyg,delayed til tuesday b s fk eulcs,0.208
2730,d6h8wyr,call hype lul,-0.354
2731,d6h8xjf,came home game already played one big delayshitshow ,0.413
2732,d6h8ye6,hyped much delayed ,-0.333
2733,d6hlsrl,series like mans sky lot hype end nothing worked ,-0.25
2734,d6nwdvo,greetings rheadphones status audio ob headphones somic vmh rebrands found late nt like ear pads shallow idea good universal earpads someone help ,-0.542
2735,d6nwidi,s s gaming spend time gaming time listening music would soundblaster omni amp hd nt know enough heard better soundstage would clearer betrer music allround use would recommend money issue ms tried xs maybe got bad one seem qc issues nt really like gaming want something less bassy,-0.064
2737,d6ny5lb,looking get good headphone ear closed pair athadx open backed looking closed back pair sorry thats correct terminology m looking good pair use home well take occupy time train planes m looking athmsr s hear complains lack bass sony mdra hear bass lacks sound quality compared msr s recommendations price point edit japan exact prices us ,-0.5
2738,d6nyfmu,m looking start entering audiophile market well would better try getting higher end headphones hear mx s good budget re good price performance edit ve mentioned japan exactly prices america mx s ,-0.125
2739,d6nymta,using fostex trp mk sound great entry level planars specific model semi open dont terrible leakage ive used home work without complaints theres sensitive people around places haha also make equally priced closed trp mk model edit something pricier closer msr price range recently picked audeze sine great portable people seem enjoy oppo pm well nad hps ,-0.417
2740,d6nyyr2,oof oppo s japan nad s seems japanese brands prices obviously reside japan ,-0.438
2741,d6nz5dl,nad viso hp japan oo wow maybe sennheiser momentum overears beyer dts ,-0.312
2742,d6o0knu,ms good value re pretty good everything re particularly good sound quality think better options price point re going pure sound quality opinion ms strengths decent sound quality fun sound signature excellent build quality detachable cable good portable use fold,-0.277
2743,d6o0lul,hello everyone m market new bluetooth headsets work would love see recommendations ve bought terrible ones lately im open price,-0.479
2744,d6o0z0l,m s used near new ,-0.312
2745,d6o1hjr,ve got piston s m looking get next step girlfriend pair mee m pro re pretty cool like sound especially w foam tips m actually kind looking cans time around thing prefer open back headphone punch something bass live fun sound something v shaped point s tiring listen prefer open back sound stage ve tried ath mx s sounded really congested bad suggestions open back headphone nt rid bass fun sound s almost m looking pair speakers sub ears lol,-0.146
2746,d6o2o5x, take occupy time train planes msr nt isolate well loud environments a would better perspective comfort provides bass oppo pm nad visio hp good isolators saw comment overpriced plus pm would nt enough bass re worried bass msr ve lot portables think a may best especially considering reasonable japan prices momentums really laid back top mx vshaped a ,-0.191
2747,d6o3mfq,mean m anal bass listen rock metal ll prioritize crisp good sound pc use bass mdra well gaming though edit saw web bose true sound ae ii travel portability word online reviews seem fairly good bad ones ,0.085
2749,d6o9cf7, ll prioritize crisp good sound msr would good option closed headphone msr fine gaming generally bose sucks sound quality unless active noise cancelling number priority better anyone else,-0.229
2750,d6o9n4w,hyperx cloud ii revolver sennheiser game one sound better better mic m using dedicated sound card one would best mic quality also important ,-0.396
2751,d6o9qgz, budget source monoprice dac amp requirements isolation opensemi open preferred type headphone full sized past headphones currently using superlux b mod mic preferred music anything mainly used gaming would like improve setup currently using budget oriented headphone would like upgrade country us,-0.312
