,comment_id,body,score
4060,dd5mxzg,guys orgasm inside girlfriends totally irresponsible wonder guys owe child support loser ,0.234
4061,dd5n6dj,re investing budget schools d think women men would know risks unprotected sex least pay make mistakes times people held accountable way long people babied expense taxpayers ,0.021
4062,dd5nltq,like going imagine much could save prevented people children flip side imagine long term negative impact less workers hmm maybe nt work utilitarian sort thing ,-0.062
4063,dd5nvzz,save money killing children worth ,0.596
4064,dd5od21,taxes nt change based government expenditure pay taxes money governments ,-0.292
4065,ddhlgmp,s good politics,-0.688
4066,ddhnj8n,think s murder even one many ,0.083
4067,ddhnl4s,think s also killing lower cost free healthcare competes expensive health care insurance insurance expensive pp like fill gap necessary women need services ,-0.188
4068,ddhp70j,neither end political spectrum wants small government want everyone like use government tool make happen conservatives want bomb planet liberals want give away store either way public paying ,-0.062
4069,ddhp7gw,well said always power control comes women s issues ,-0.167
4070,ddhq8xp,think real core issue sex without consequences s abortion though article states s also contraception long take get morning pill otc remember huge deal nt generally agree abortion lean conservativerepublican understand s necessary nt see parade around limited government also want use government limit people s rights whether s abortion marijuana etc ,0.396
4071,ddhr15e,s worth saying position conservatives though admittedly probably officeholders even majority registered republicans decrease abortions unequivocally good thing governmentfunded birth control still bad thing hold position could various reasons put question aside nt inconsistent illogical oppose abortion government subsidized birth control even utilitarian argument appealing nt agree issue mostly important note position illogical untenable ,0.042
4072,ddhs3tf,honestly nt get many women opposed abortion nt realize abortion always keep taking place s free accessible rich ,0.083
4073,ddhsjoc,want drop abortions make birth control counter drug take something bring something return ,-0.085
4074,ddhw9cl,freedom choice freedom consequences someone opposed using bc nt mean forced pay privilege regardless whether social good mathematically zero problem someone choosing abortion using bc none problem idea taxation used fund someone pays bc abortion complete autonomy receive public funds become subject people people assholes absolutely get say money spent ,0.213
4078,deqdho0,nt know welfare queens perhaps experience fill us thx,0.125
4079,deqdqeh,reading comprehension m saying america suffers welfare queens m saying see symptoms institutions working us continue vote selfinterests blame la welfare queens outsiders eg mexicans ,0.021
4080,deqjoug,politics money happiness make happy enough get vote keep making money getting votes money reason changes made ,-0.188
4081,deqlj95,meanwhile india extends maternity leave weeks mandates daycare centers within certain distance office moms visit daycare times day ,-0.104
4082,deqm9cy,yeah fixing things requires taxes government ruling class nt believe aggressively spends money dismantle ,-0.106
4083,der0j4u,much s significant amount people believe poor lazy fraudulently collect welfare decent people work s also people think welfare recipients black hispanic noncitizens many people work long hours low pay convinced vote guys like trump universal healthcare somehow dangerous socialism ,0.062
4084,df96qxv, men provide universally unattractive would case ,0.042
4085,df96qyw,playing devil s advocate supporter nt husband could fatherunclebrotherson whoever man house rest reply exceptions ca nt screw ,0.021
4086,df96xh5,well classic answer would men always better anything else rare exception re getting hired coz re sex objects obviously one ever would see otherwise always find man qualified,0.229
4087,df97ef2,think s evolutionary biology thing sex often comes much higher cost females hence refusing mate unless males go way prove re fit committed like strong building nest etc,0.125
4088,df97hh9,yeah sums everything perfectly gouverment tried legistate equal inheritance many mostly men hah lost shit even though islamic inheritance default equality option ,0.298
4089,df9aj3b,s observation part though think attributed sexual selection recently wealthy powerful socially dominant provider type would boosted probability woman s genes surviving would neat see data s always interesting stuff seen studies human sexual selection primitive warring cultures like yanomami amazon s huge disparity reproductive success men ve killed nt ,0.083
4090,df9gzpi, primitive warring cultures like yanomami amazon s huge disparity reproductive success men ve killed nt could elaborate please ,0.089
4091,df9kktx,wage gap presented ad nauseam demonstrably false s comparing careers many male dominated fields pay higher many female dominated ones s litterally comparing engineers teachers whereas compare two people field job experience yet different genitals wage gap almost completely vanishes even true could company get away hiring men could pay women money work mention s illegal also extra credit would know rape went unreported s reported even sub get damn reddit ,0.083
4092,df9rfxf,would say black lives matter movement nt call lives matter ,0.083
4093,df9rs8q,women make less work circumstances show single study proves eat bananas ,-0.064
4094,df9srtw,s arab world see argument least several times week reddit threads economy low wages job advice like young american people ,-0.128
4095,df9tqg5,someone needs tell people history long history women working outside home especially islamic golden age really think best way fight back would point muhammad s pbuh wife khadija merchant worked outside home namely trade routes going syria yemen considering based mecca really long distances especially back going able come explanation complete bullcrap stuff among muslims needs stop seems people forgotten history teaching accurate history muslim world needs top priority help deal bullcrap ,0.396
4096,df9ydzu,risky comment good luck defending,-0.188
4097,df9yso7,twox sub men tell women feminism unnecessary ,-0.042
4098,dfa2yat,see friend coming aggressive kinds feminists rub wrong way friends lost custody kids unemployed women meth arrests tried convince join men s rights group d say sorry ca nt associated people even every great re right ,0.188
4099,dfa6mhp,give example sexism men nt direct result sexist ideas women men lose custody battles raising children seen woman s job men get harsher prison sentences women women home kids women seen weaker men take riskier jobs women seen dainty handle men nt allowed cry women emotional ones men ca nt raped re stronger sex able fight weaker sex plus re supposed always want sex toxic masculinity seems perceived sexism towards men comes directly ideas persist society sexism towards women ,0.25
4100,dfa6qwf,yeah m hugely interested sort revenge style justice also feels extremely random someone like carry throughout life addition actual justiciary penalties versus ,-0.149
4101,dfa7mqb,problem though historically women faced discrimination due sex able vote able property credit card ones viewed inferior men s stems ,-0.062
4102,dfa7za3,historically men asked risk life limb armies women nt indeed say men required people low opinion female battle skills say women allowed earn money people expectation men provide women protect ,0.191
4103,dfaaa87,would rather support public assistance let get job nt seem men clambering support ,-0.146
4104,dfabxwj,m talking revenge like karma let put way years feel justice served s sitting jail cell hots cot able see family possibly get college degree rec time years hear died alone streets homeless hungry shunned society addicted crack s latter ll consider justice knowing tax dollars paid minimally comfortable life ,0.229
4105,dfafo77,men support women men support household married many situations come women eventually work outside home aside needing two cars expenses come raising family ,0.229
4106,dfajkzy,sure someone else already posted first counter argument comes mind always plenty jobs women less likely take ditchdigging roofing operating heavy machinery welding etc mean women professions re generally maledominated ,-0.021
4107,dfapjjp,nt realize fast things slip backwards women iran educated rate jobs liberated ayatollah came power rights skidded backwards point today enforced hijab male escorts required public etc might unpleasantly surprised many equal enlightened men would happily put women back place ,0.188
4108,dfaunxp,yeah nt call property directly prefer term jewels covered candy completely unaware s literally property yeah smaller brain thing based hadith women deficient mind religion,0.125
4109,dgipl17,one years ago even though right place raise child still regret day think id rather live child years whole life guilt ,-0.255
4110,dgiqgqr,one difficult decision ever made looking back know best family never know truly right try best provide cope hardest part beforehand making decision afterward regret knew tried best good luck xoxo,-0.362
4111,dgiylns,wife go mexico abortion twins bg big surprise financially emotionally dissertation obgyn nurse moments every often sadness miscarriages natures way anyway look life moments choices consequences experience made little spot gardens sit talk angels ,-0.021
4112,dgj2lx3, best friend got pregnant last october aborted three weeks found found weeks aborted knew would nt support family ex told would nt pay child support told abort messed pretty bad months abortion still suffers guilt sadness day know knew right choice would s incredibly important make right choice love hugs op xo,-0.125
4113,dgj3qbd,confession ve endured two really regretted first one awesome women starting came conclusion together nt easy decision means fades time s haunting would like believe s right heart s selfish ,0.021
4114,dgj46rj, downvotes comments wonder ,-0.125
4115,dgj4cgt,one year ago nt regret many reasons mainly person father turned either sad keep going sad new baby made feel like id turn sad need even want body rules know made right choice still feel sad come accept okay ,-0.188
4116,dgjcte8,never sounds like ve thought logically think know answer make decision hope works nt worry anyone else kids best ,-0.271
4117,dgjm2e8,one grateful option regret one bit go gut ,-0.229
4118,dgjprx0,one years ago never regretted would terrible resentful mother back months pregnant thankful opportunity since build great life welcome child loaded choice child teenage mother wanted break cycle growing really really hard mother nt ask born still kind wonder nt abortion ,-0.104
4119,dgve2v0, s nothing wrong religion whose laws say man s got wear beard cover head wear collar s violation laws become crime state parents re talking lack choice aaron sorkin ftw ,-0.042
4120,dgveo3q,s like saying pedophile racist never act way form still wrong opinion respected ,-0.067
4121,dgvewuu, accept neighbor s view murder refuse impose others take absurd territory abortion morally wrong largely matter opinion preventing actually seems net negative benefit society taxation regulation degree demonstrably positive necessary ,0.146
4122,dgvexwa,really hope nt learn read write one dastardly public schools would awkward ,0.042
4123,dgvf5vx,ridiculous nt give state money things agree come house lock cage kill neighbor decides give income locked hoa county become acceptable steal people s money ,0.087
4124,dgvfcjm,called social contract aka law free live elsewhere dislike society value things like roads emergency services education etc society enacted taxes pay things make use none services could least entertain idea taxes theft find unlikely ,-0.021
4125,dgvfkbq,donald trump m really religious used prochoice m milking republican base m going impose beliefs abortion others ,0.042
4126,dgvfy5r,called pro choice pro abortion dumb dumb one abortion unless could go back time convince mom go ahead make difficult decision going call pro birth since typical pro birthers care people giving birth say fuck life born ,0.854
4127,dgvg0g0,right parents whatever fuck want ,0.688
4128,dgvgfjw,conservative philosophy inherently nut jobby however little support s people government claim represent philosophy nut jobs ,0.191
4129,dgvrqjd,historically well governments mexico s socialist revolution last century killed tons religious socialist takeover russia ,-0.021
4131,dihqp1y,nt think deny service based religious beliefs honest pharmacist master chemistry necessarily qualified deny anyone medication may improve life due fact complete medical history issue personally upset agree statement walgreens made ca nt job due religious objection medication field period ,-0.188
4132,dihrb15,two things fuck walgreens poorly thought spineless policy pharmacist needs find new job ,0.804
4133,dihrsun,m taking human sexuality college course summer read day pharmacists allowed decline fill moral religious reasons ,0.021
4134,dihsd2f,object morally bc nt want participating system offends religious morality well one transaction constitutes participation step aside another pharmacist fills nt still participating would seem pharmacist would moral contradiction bc helping company provides bc one form another edit used bc abbreviate birth control ,-0.167
4135,dihsyfu,unpopular opinion think providing service due religious beliefs okay think shopping somewhere due disliking policy okay re hoping society everyone feels comfortable skin s done s okay disagree society long s done hateful way ,0.0
4137,dihtaup,maybe grow fuck fucking job ,0.896
4138,dihthcd,s big deal store nt offer level customer satisfaction demand think get better experience somewhere else go shop elsewhere s capitalism hard respect walgreens allowing employees latitude work without compromising principles takes guts shows appreciation employees people walgreens first rate store even pay money getting shape awesome balance rewards healthy choices check ve made wish stores cool drugstore use ,-0.062
4139,dihtm2l,damn job fill prescription ,0.341
4140,dihtsb5,m pharmacist fuck guy grow moral objections hope consistent quite alot shit comes conflict anyone s morality ,0.583
4141,dihtt6a,would love see shit storm clerks refused sell gunsammo walmart morally oppose firearms ,0.511
4142,dihtvld,m probably going get downvoted hell subreddit hardly feel like forcing someone newdifferent career answer pharmacist became pharmacist birth control created fault job requirements placing changed since got degree seems like walgreens problem rather individual pharmacist problem make sure multiple pharmacists regardless individual pharmacist s beliefs one forced provide something morals,0.104
4143,djx9wdh,s lot women working construction compared previous years s reason s nothing woman ca nt construction man ca nt think alot people construction shooting foot hiring women cut half talent pool ,-0.167
4144,djxitsy,s big deal people problem s s pink coloured crane london guy owns huge skip company fleet west ham colours prem football team ,-0.042
4145,djxlke4,hold drug head forever make money,0.083
4146,djxnzwb,universal thing pink girl s color blue boy s color like united states opposite sure pink feminine color japan ,-0.271
4147,djxok3g,waiting susan b komen foundation lawsuit rad crane though,-0.25
4148,dk2ziv5, scotland giving free toilet paper soap awesome ,-0.542
4149,dk37b8h,could also blessing yikes m late time break white pants ,-0.354
4150,dk38ahr,like umbrella s ability banish clouds ,-0.5
4151,dk399ov,ca nt wait become old kick allwhite pantsuit vaguely purple perm edit nt know downvoted m perfectly serious wish could vaguely purple perm right ,-0.062
4152,dk3mis1,far smartest thing government done s country past years ,-0.354
4153,dk3qibr,would like hear scottish person say menstruation d awesome story awesome everything awesome ,-0.062
4154,dk43y8m,iirc tax issue due european legislation uk brexit rant circumvent uk spend everything raised tax funding women s charities ,-0.229
4155,dk4foco,people actually want achieve ban contraception get abortions ban abortions get unwanted children teenage parents going back everyone children totally great idea nt get logic understand ethical issues take realistic look endgoal must aware people nt gon na stop sex ,0.312
4156,dk4gzl2,think primarily ethical reasons like mentioned joining part community reinforces idea abortions contraception wrong well course going argue ideas go norms ideas right wrong group make analogy would like trying create pants law imagine someone came idea pants law citing sources statistics pants law prevent disease unwanted children people wearing pants would make things uncomfortable least course fight spite benefits imagine uncomfortableness situation multiplied concept abortions thats people fight it goes values makes uncomfortable,-0.104
4157,dk4ijbb,nt think want babies kind wants sex ,0.213
4158,dk4isnn,exactly next presidential campaign ll able say abortions rise need something ,0.042
4159,dk4iwxd,s world works s sine wave ,-0.417
4160,dk4jrx9,lie look terrorism used lot worse s public eye kill people terrorists change constitution stab people zero deaths terrorist connections jesus christ let s start another war ,0.375
4161,dk4kgbz,think s control agree lifelong female resident texas lot extreme religious bs used justify misogyny think s formula unwanted babies poverty less likelihood education fearful unhappy male female population easier control party religion state nt really matter except makes easier implement wanted outcome imo s wealthy getting moneypower easier control slaves crazy conspiracist well maybe crazy half century observing s looks like ,0.042
4162,dk4mtwy,nooo shiiiit access birth control less unwanted pregnancies nt rocket science,0.562
4163,dnb13ck,m surprised comprehensive education access control always winner study study locale locale proves true need figure get conservatives shut god s plan abstinence solution five seconds see type access works wonders ,0.13
4164,dnb1pqe,except reducing teen pregnancies nt exactly goal ,-0.128
4165,dnb2e54,exactly birth control good deciding future sexual freedom bodily autonomy none helps punish sinners sex s obviously good s,0.333
4166,dnb4fj7,yeah s mainly punishing girls sex,0.229
4167,dnbe7qr,doubt s s promoting birth rate american babies rather punishing people sex right christian christians antisex outside marriage ,0.312
4168,dnbekq7,fire forget birth control anazing source vasectomy ,0.021
4169,dnbf3qi,think iud technically considered fireandforget wireguided ,-0.271
4170,dnbf57x,iuds best ,-0.333
4172,dnbmprv,getting awfully crowded though ,-0.396
4173,dnbqy5q,plus military stocked poor people need tuition money poor people front line ,-0.042
4174,dnbze6e,like colorado light years ahead everyone else beautiful state wish could still afford live ,-0.625
4175,dncuxpf,gon na afford edit wow nt think d get downvoted hell sincere question government afford something awesome since know nothing government finances guess double question marks conveyed wrong impression america behind,0.064
4176,dncx19u,taxes free pills cheaper welfare unwanted children single mothers couples ca nt support kids ,0.083
4177,dnd1v0b,refreshing seeing nova scotia front page good thing last time pizza corner dissolved less forget ,-0.417
4178,dnd30ld,man negative thing positive thing edit m fine downvoting m dude apparently ladies subreddit least get answer m woman idea pros cons want educate matter ,-0.042
4179,dnd36i7,s really good still catholic gps would nt refer religious grounds ns nt runaround ,-0.083
4180,dnd3wbw,s awesome would great nb would fund abortions good development interestingly learned pei government fund abortions residents come nb hospitals ,-0.298
4181,dnd4v12,fuck haters fuck em,0.833
4182,dnd7c9g,sending love support way right ,-0.413
4183,dol8sw9,think point avoid terrorist attacks sure much women tbh ,0.188
4184,doljsfy,personally disagree concept well law dictating ca nt wear public nt seem like way handle isolates vulnerable group even ,-0.042
4185,dolprj0,wow people never said ban imposed due religion everyone bringing islamic religion providing information fight legally walk around completely covered head toe wear mask top eventually guarantee somebody would complain ask stop made feel unsafe whatever s human nature feel threatened someone decides cover face m saying agree ban comments ridiculous completely missing point ,0.043
4186,dolqya5,let shit show begin ,0.646
4187,dolrxji,s fine nt want feel attacked way make feel like part group treat like anybody else continue exempt rules society re religious reasons actually separate us ,-0.312
4188,dolt44h,meaning behind good going ban women wear things religion use bus ,-0.146
4189,dolvfto,hell carey price going ,0.043
4190,dolx7xm, population running around hiding faces aside antifa ijfs ,0.25
4191,dolxhhe,banning face coverings make huge societal changes dog levitate making walking easier taxes go bans nt anything except alienate people,0.234
4192,dq3apkx,believe murder yes birth control education would help matters lot ,-0.021
4193,dq3as3n,even believe s murder would still make far sense spend money bc s one reasons nt really believe argument true goal already way fix ,-0.125
4195,dq3cg85,know great real sexual education nt concentrate abstinence ,-0.085
4196,dq3d581,true d surely want everything possible prevent right including teaching sex education making birth control accessible people ,0.0
4197,dq3e6gl,maybe consider actually teaching kids sex schools maybe informed people make better decisions health sexuality maybe knowledge power ,0.104
4198,dq3eehd,see re gon na go whole murder route nt see healthcare improving foster care system nt rise priorities ,0.104
4199,dq3gnww,start thinking making sure child raised healthy loving environment men focused making sure women keep babies showing little concern impact bringing unwanted baby world ,-0.167
4200,dq3iu9o,agree would good idea looking issue opposed abortion bc different reasons example oppose speeding without supporting stricter traffic laws ,0.0
4201,dq3k23k, sex ed texas ,0.125
4202,dq3k2gf, maybe parents take role parenting teach children health sexuality way fits worldview whatever view may dont think need outsources parental responsibilities make statesschool job something done home ,-0.292
4203,dq3mpbh, specifically gut sex ed classes states like reasons defund demonize planned parenthood want uneducated kids born s voting block minorities problem welfare queens anchor babies potential terrorists white kids feed fiction poor nt fault s someone elses vote us ll fix problems ca nt well s democrats fault s narrative gop pushing awhile s talking point s generations raised doctrine control pushing even harder ever ,0.292
4204,dq3qis9,ok supporting rapist ,0.458
4205,dqd2w45,problem sexual harassment clear cut everyone american society tells men woman says nt really mean s playing hard get try harder watch movie rocky s american icon look adrian apartment s tough watch think s someone root ,0.0
4206,dqd359j,every day several times day i get sexually harassed try nicely put place men get offended sometimes belligerent i work retail i guess grateful even hit right gets old ,0.17
4207,dqd3w2n,two lucky enough work place enforce kinds rules s lucky boyfriend works either strength second voice back give enough confidence speak owner choose firing one employee two walk job ,-0.085
4208,dqd3wis,point rape one violent crimes commit people comparing sexual harassment still terrible clearly trying make seem less,0.196
4209,dqd6gzf, people comparing sexual harassment assault edit downvoted using correct term sen al franken would considered sexual assault physically touched lady sexual unwanted manner ,0.354
4210,dqdclkb,m waiting happen racism old supervisor used call spanish speaking workers job oompah loompahs faces another time woman called asian working that chink bitch plant manager s hearing nothing happened nt get started police harassment want racism get treated level seriousness harassment people abuse positions fired ,0.438
4211,dqidqrd,birth rates time period ,-0.396
4212,dqiebvj,asked yeah sex ed schools taken seriously s like united states century behind s easy obtain contraception years ,0.042
4213,dqieho8, s easy obtain contraception years parent nt moron drag friend planned parenthood get pill mother said quote paying sex hence would nt let use health insurance dumbass sister already gotten knocked birth control easy get money control medical decisions car group often missing items makes stunningly shitty heat moment decisions ,0.4
4214,dqietzl,want easy affordable access pill based contraception battle pharmacy companies country long keep avoiding single payer system remain problem obtaining medication besides tylenol,-0.208
4215,dqieucp,oh yeah agree fact something happens teenagers sex emotionally ready unfortunately something happens probably always ,0.042
4216,dqif2gj,cant figure condom shouldnt sex ,0.292
4217,dqif9j2,small midwestern town grew lot pharmacies would nt sell condoms kids absolutely ridiculous meant almost one high school condoms use moved back town college made sure let sister friends know would happily buy condoms also offered talk time questions teens nt want talk parents older people nt want talk teens helps think ,0.083
