,comment_id,body,score
1082,ebmveab,nt depend instance suppose know person well know re alcoholic suppose furthermore know choosing drink calorie counting desire go sleep early today order spend time tomorrow different friends nt approve believe hate taste cider seriously cider actually amazing believe really immoral circumstances ,-0.208
1083,ebmx5oc,alcohol dangerous highly addictive regardless intent drinking drinking pushing consume could harmful substance existence would offer friend cigarette likely even offer one sure push probably recognize benefit smoking smoking addictive want part reason someone got addicted know amazing cider sounds like perfect gateway developing addiction alcohol ,0.062
1084,ebmxcbo,honest unfortunate thought drink friends order enjoy time broke details would likely find reasons enjoyed quite separate fact drank depressant filled senses slowed brain edit enormously depressing suggesting need drink fun earned karma post care internet points care prevailing attitude reject viewpoint like ,0.087
1085,ebmxi5f, pushing consume could harmful substance existence s bit exaggeration s like thousand things consume immediately kill alcohol pretty tame drug standards shit d strongly contend mountain dew dangerous alcohol ,0.511
1086,ebmxo02, honest unfortunate thought drink friends order enjoy time nt think nt anything still ultimately choice enjoy friends many different contexts allowed convinced change context led great night broke details would likely find reasons enjoyed quite separate fact drank depressant filled senses slowed brain actually definitely enjoyed drinks helped relax get good buzz going feel social energy reduced anxiety s many people like drink ,-0.125
1087,ebmy27k,would like hear argument mountain dew ,-0.375
1088,ebmy6wi,s highly caffeinated mainstream sodas one highest sugar contents well probably commenter referring ,-0.25
1089,ebmy8pz,lot reasons someone drink alcoholism plenty private personal choices ,-0.229
1090,ebmyijf,seem forgotten benefits alcohol nt downside like drugs consumed regularly around world describes sounds like able get little bit comfortable due alcohol initial boost comfortableness could well s made possible good evening sure likely could got effect means nt make s bad thing ,0.021
1091,ebmyq98,well personal level family history heart disease history liver problems least mountain dew vastly dangerous alcohol simply calorie count sugar content realize certain alcoholic drinks come problem clear liquor definitely argued healthier soda ,-0.085
1092,ebmyybh,said mother hitting child child physically emotionally less capable defending adult nt believe alcoholic less adult struggling alcohol addiction agree total dick move pressure anyone anything nt want think phrasing analogies far mark ca nt agree assertions alcohol unhealthy damaging comparing pressuring someone drink directly participating child abuse obviously legally morally different things vastly different categories reason think way base ,0.292
1093,ebmyz25,also going assume possibility offer drink someone might relapse consumption high frequency high quantity mountain dew actually wonder point l mountain dewday worse bottle wineday ,0.0
1094,ebmzg8m,honestly would pester someone nt know well enough know alcohol problem drink situation never come ever hand family friends pestered times personally nt pester people anything annoying yes good well addict pestered drink pester friend simply nt want drink annoying big deal ,0.109
1095,ebmzmhp,agree s annoying encouraged drink nt want s also annoying buzzkill contexts sober person going fun ll bring others unless re good disinhibiting ,0.277
1096,ebn017g, common exaddicts view poison choice harmful associated personal harm experienced agree somewhat point however somewhat bizarre dangerous drug viewed brazenly two things drinking moderation especially dangerous small increase cancervascular disease risk alcohol use far widespread drug harmful effects seen far often think letting history cloud thinking due respect ,0.0
1097,ebn04eh,following scenario group friends go dinner bottle wine ordered table person nt following conversation takes place xb person b would like glass wine person thank person b sure really think would like person nt like new zeland reds find dry person b know one nt dry s similar merlot bordeaux last week absolutely loved xb person b scenario equivalent parent beating child ,-0.043
1098,ebn0fi6,think though stopped drinking like years health issues want risk anything happening friends pretty supportive still lot fun going drink every moderation get judged drinking agree help really fun get beers friends long week always necessary drink go ,-0.083
1099,ebn0u09, trying change mind say thank god someone actually thinks like currently high school live city many people age drink every week people even every day also take drugs like ecstasy shit along occasional marijuana cigarette tell many times people trying get go parties shit go bad fun wait till never see people ,0.417
1100,ebn0z2b,wait op finds s unpaid internships ,-0.354
1101,ebn1yic, mentioned particulars person situation matter extreme situation based sadly common real life events person abusive relationship told partner could drink wear certain clothes would embarrass themselves instance avoiding alcohol abused partner whose normal alcohol intake previously drinks individuals also recreationally drinking solo drinking would complicit engaging abusive partner controlling demands tricky situation morally gray area assumptions underlying drinking particularly salient case offering sip one drink may fast way challenge assumptions underlying refusal well model abusive partner necessarily control others behaviors ,0.021
1102,ebn20ya,depends situation office party agreed someone barely know agreed also depends culture norm cultures require guest first refuse several times finally giving accepting host expected continue offer attempt convince guest accept guest situations often wants drink must polite first refuse especially true guest woman would seen rude stingy host ask guest several times would want drink see pestering host socialcultural obligation ,0.0
1103,ebn269q,pestering someone kind drug reprehensible matter,-0.128
1104,ebn2l1z,wise words brandon boyd late s rock band incubus s much better everyone ,-0.319
1105,ebn3suc, non drinker choice neardear ones drinker drink b cos really like taste know lot ppl like still drink secondly like fact something self lose awareness even fraction used fall trap request drinking realized enjoy drink everyone else funto part fun drink something like cases ends water juice days give stare close relatives friends pushes drink give drinking everyone deserves happy way ,-0.021
1106,ebn427g,position would include somebody ordering round shots group morally reprehensible creates pressure drink think people intuitively say person generoustrying get everyone good time agree wrong encourage someone drink nt want wrong especially person problem person already decided drink struggle see gently pushing another sake everyone s fun evil ,0.083
1107,ebn4iib,someone says contexts respected matter reason offer someone drink fine say continue pressure saying yes huge injustice coercing something said morally wrong ,-0.125
1108,ebn4qe2,pressuring someone drinking alcohol morally reprehensible pressuring someone engage possibly risky behaviour like mountain biking skiing pressuring overweight person desert list sorts statistics effects alcohol prevalent effects obesity also seem hard time separating personal experience alcohol average experience alcohol problem s manage like s ultimately overweight person put fork also start drinking soda lime wedge people assume s drink leave alone ,-0.062
1109,ebn5c7e,concede pestering someone drink rude regardless situation concede offering drink alcoholic nt know persons history rude cause m tired re mind reader bullshit ,0.375
1110,ebn5tzf,basically eating mushrooms ,-0.5
1111,ebn70c7,friends middle divorce breakup ll friend pretty much force go re wallowing shit weeks go nt feel like drinking re sad ll pester great night happy next day saying shit like thanks taking last night needed asshole ,0.447
1112,ebn7bun,maybe open new experiences trying something nt mean ll pounding s erry night ,-0.146
1113,ebn8oqr,feeling prescription meds someone trouble social situationsanything really whatever reason takes x substance let s assume safe amount finds works wonders ,-0.213
1114,ebn9uaf,nt need alcoholic get blackout drunk start driving alcohol negative effects people alcoholics people even drinking ,0.043
1115,ebnc22e, encouraging kid high school drink since illegal ,-0.083
1116,ebndew8,already concede viewpoint beginning okay ask would like drink okay say oh come drink ,-0.021
1117,ebner8x,m european generally start drinking ,-0.333
1118,ebnfvd8,apologies missing post carry ,-0.583
1119,ebng6q4,viewpoints like exactly think important take stand unwarranted pressures others much rather support defend people make good decisions like rather try validate bad behavior masses ,-0.261
1120,ebnhysd,sure agreed good place probably made sound little hard ,-0.375
1121,ebnmrxf,m way expert would guess probably depends relative tolerance alcohol versus caffeine also m sure s fair leave factors drunk driving equation mountain dew might worse strictly medical sense assuming constant rate consumption s really whole story ,-0.196
1122,ebntje8,nt factors exist level everything l mountain dew uncontrolled unhealty habbit one less serious note easily imagine succesfull drinks one bottle wine per day much l mountain dew ,-0.229
1123,ebnvc3j,certain types poisoning toxin processed liver begins damage toxins ethanol alcoholic beverage take precedence broken first given body time clear dangerous toxin damage think quite meant situation encouraging people drink anything else hand good thing btw explicitly name toxins works reason ever ingest inhale chemical explicitly safe human consumption go whatever emergency poisoning services available immediately repeat try ,0.188
1124,ebo0sjf,know successful people drink least much sugar caffeine energy drinks s absurd least used know reasonably successful high school college students point externalities s uncontrolled unhealthy habit case alcohol literally kills people every day people habit ,0.146
1125,ebolcfj,average european drinks early understand really fucks brain right realistically speaking drinking age minimum younger brain still growing susceptible big changes would problematic future also start drinking earlier likely start developing addiction also illegal argument generally start drinking solve problems right sad excuse blaming continent people instead ,0.25
1126,eboppmn,sounds like puritanism ,-0.043
1127,eboqqk7, atheist judging someone decided healthier avoid mental illnesses sounds real pathetic,0.271
1128,ebp1x5h,puritanical undercurrent american culture ,-0.188
1129,ebu4cdt,know people evidence ,-0.125
1130,ebu4gpu,think one main problems psychological problems general difficult prove show two people one person serious depression lazy way completely know difference think cases like exercise compassion empathy end day probably need help ,-0.104
1133,ebu5e1j,s evidence theory ,-0.574
1134,ebu5phm,disagreement becoming ve culture since first diagnostic statistical manual mental disorders dsm revised ,-0.021
1135,ebu5pxc,therapist many ways assess depression anxiety saying questionnaire lied simply wrong ,-0.146
1136,ebu5q0p,logical conclusion argument depression anxiety becoming culture therefore less acceptable potentional depression anxiety victims people might ,0.062
1138,ebu7jy2,humans inherit traits inherit learned behaviours may mimic entirely different unlearned well learned ,-0.312
1139,ebu7m8l,experienced neither anxiety depression believe people would embrace good thing crippling state people would almost anything get commit suicide since neither someone experience mental health professional opinion issues argument anything ,0.083
1140,ebu96b9,tell depression back see therapist give questionnaires assess soon told felt nothing anymore diagnosed depression guessing clinic went good ,-0.17
1141,ebu9e23,honestly think way categorize think psychology field nt think part problem top people field extremely ambitious comes categorizing people lack fundamental knowledge necessary sense jumping gun ,-0.104
1142,ebucfi1,honestly think s lack relations easy place meet meet like minded people think problem psychology catch al test liability issues prevent psychologist able make personal opinion boss listen conversations passed patients audited human try make empathetic choice thier patients regardless tough love think patient needs ,-0.021
1143,ebucg0d,someone getting treatment depression anxiety psychologist s lot work usually much work changing bad habits changing bad thought processes suppose someone got diagnosis refused get treated simply used excuse may point whole idea someone going office lying questionnaire refusing work psychologist actually improve seems implausible s point even going see psychologist ,-0.021
1144,ebuchix,know people lying questionnaires embracing depression choice sounds like may devaluing type depression mild depression someone getting stomach ache feeling pain nt devalue crohn s disease depression anxiety sometimes motivated get better change habits nt mean depression gone depression swings like chronic illness caveat hope answer nt sharp two invisible illnesses told s bad feel years ate started better attitude d cured ve lived half life sorry post seems angry tried best ,0.125
1146,ebud9xw,born chemical imbalances brain struggled depression anxiety entire life thing pisses people make depression anxiety personality thing ever talk defines also makes incredibly mad people want help friends throw away prescriptions work still staying night eating unhealthy exercising drugs depression anxiety sickness treated societies romanticizing sickening yes try suppress feelings also expect everyone care personal problem personal sickness nearly everyone power fix stop pity party ,0.021
1147,ebudms4,drugs commonly used treat depression anxiety similar potential abuse ,-0.208
1148,ebuepbn,sort help lazy person need though laziness laziness certainly depression think op getting she thinks laziness depression completely different things lines blurring accommodate lazy person way treat depressed one depression problem laziness shitty human trait imo treating lazy person compassion empathy make shittier humans,0.479
1149,ebuf26v,call bullshit though sound mean anything think agree op say depression anxiety becoming cultural thing seemingly everyone claims issues hard time believing people claim issues actually doubt one second people problems exist absolutely really many people claim issues actually ,0.375
1151,ebufqhr,sort mean aware stuff saying really depends presenting depression anxiety exist spectrum even people symptoms consistent clinical diagnosis still often benefit therapy treatment would adjusted accordingly ,-0.229
1152,ebufyvu,read article day posited depression root problem simple demoralization symptoms similar demoralization cured meds like depression ,-0.167
1153,ebufz15,s talking people nt clinical diagnosises least interpreted huge difference person debilitating depression lazy yo nt want get job re depressed yet beg mom dad money party every weekend huge difference ,0.083
1154,ebugca1, problem claiming anxietydepression excuse lazy life failures yeah sure people throws words around thing happened ocd oh wipe ass poo toilet m ocd yikes s much idiots gon na idiot ,0.532
1155,ebugn59,order claim trend need provide evidence anecdotes sum evidence neither op possibly know statistically relevant portion american population even confirmation bias something humans prone evidence ,-0.062
1156,ebuh3j4,ok would argue believe current evidence contrary assertion evidence aware tells otherwise ,-0.333
1157,ebuhntj,nt unpopular opinion s fact large part due music artists like lil peep example instead bringing themes drug use depression meaningful message romanticize ways make sound trendy cool rely drugs depression anxiety edit impressionable kids think s cool go onto lie fake depressed shit s stupid ,0.283
1158,ebuhr07, like saying teapot orbiting earth evidence contrary must true,-0.229
1159,ebui7sg,never change view sooooooooool true,-0.511
1160,ebuih8u, know hey becoming culture much becoming aware effects adult leadership cub scouts boy scouts see kids high anxiety know know properly deal treat kid s kids called bad never given real chance ,-0.167
1161,ebuii0d,depression like capitalizing things nt need capitalized mental disorder ,-0.062
1162,ebukur6,psilocybin mushrooms reset pattern thinking behavior safely unlike toxic compounds people ingesting truckload prescribed doctors ,-0.188
1163,ebulo2o,true abraham hicks exercise meditation helped lot ,-0.458
1164,ebum0kt,find right meds like fog lifted finally live depressed antidepressants take mood stabilizers feel like ever get hate hard people psychiatric medication people say shit meds chemicals,0.292
1165,ebum85k,snris make feel high like antidepressant,-0.37
1166,ebumdx6, hating means hate term really glad happy working sincerely advocating believe way dealing issues healthier lasting way science anecdotal reports speaking invite little research decide may best thing ever ,0.128
1167,ebumwh0,thing bipolar disorder times mind altering drugs send people bp skyrocket mania,-0.083
1169,ebuqp4z,entirely clear substances everyone many condition report amazing results doctor like said something research decide countless stories info reddit alone many microdosing reporting truly unbelievable results like advocate full experience reaped pretty great benefits powerful medicine may well find someday imbalances like bipolar depression anxiety ocd ptsd many conditions treated even eliminated careful use psychedelic medicines research starting show much ,-0.062
1170,ebuucgb,akin saying earth flat observations tell damn experts op made initial claims agree op thread ones provide evidence views way around ,-0.188
1171,ebuus2i, rather stick lithium know works change mind comes mushrooms actually something undoubtedly never cure mental illnesses thing cure management get hopes know maybe work maybe medications big bad wolf everyone makes experienced finding right ones never know amazing,-0.021
1173,ebuwp6n,good luck,-0.75
1174,ed4yak6,hello individual level imagine person volunteering perform activity stepping telling no business mine tell individual much less compensated ,-0.188
1175,edbbeh4,everyone free set price labor person dumb enough financially able work free decision fact millionaires america first generation millionaires despite many people say ton classwage mobility country unpaid internships responsible keeping people poor agree unpaid internships dumb think government telling people comes area labor person tried tell poor unsuccessful afford take unpaid internship would probably look laugh ,0.217
1176,edixdet,id rather acknowledgment pest front rather unexpected disturbance would cause sudden reaction eg started spider spilling drink food item ,-0.271
1177,eervgva,line women s always longer re taking away one advantages males get social setting like xb sorry best could ,-0.312
1178,eervqsj,one downside see male hey gender equality guess ,-0.104
1179,eerxipd,well seriously mean maybe worried men women passing entering bathroom men might say something inappropriate offend ladies like sorry delay maam takes get feller back control s let something like nt know ,0.146
1180,eery11d,yeah see harassment angle feels like would infrequent real issue ,-0.239
1181,eerytho,agree bit left old school thinking nobody s really given thought ,-0.396
1182,eerzz96,whole reason two bathrooms first place men dont care women use women going flip man bathroom,0.125
1183,ees09jk,imagine people probably would nt want take stinky sloppy dump open door someone opposite sex waiting enter ,0.583
1184,ees0sp1,actually cant shit know female strangers around way cant us urinals anybody else using ,0.146
1185,ees38dg,wow gender stereotype right ,-0.062
1186,ees3tb6,also women apparently disgusting bathroom nt clean toilets women s room typically x worse ,0.104
1188,ees732l,mean go try,-0.646
1189,ees7ln9, s called gender neutral bathroom one problem ,-0.229
1190,ees9zy4,gender neutral restroom arguing ublaketank said genderspecific restroom ,-0.146
1191,eesal2c,women s men s multiuse bathrooms separated safety nothing women offended concept using toilet man also used single use stall would never issue women concerned man women s room worry man easily overpower attack especially enclosed room nearly concern men due strength differences ,0.167
1192,eesc024,leave toilet kind dare better thing ,-0.13
1193,eescck4, disagree though additional arguments still feel like missing point particular thread assuming male due context hop line singleoccupancy women restroom going point contention ,0.083
1194,eesclgt,mean really anything gender provide urinals right kit brave enough see anything wrong providing facilities quick ,0.021
1195,eescmpl,really would nt reason men s one nt available way would contentious line men s guy decided stand line women s make line longer reason ,-0.104
1196,eesdgpx,let try another way clearly marked men room women room single occupancy men three women respective lines understanding people add line within next minutes bladders work saying think would smooth sailing get shorter women line obviously get funny looks minimum even though singleoccupancy wager presence make women uncomfortable wrong misunderstanding argument ,0.0
1197,eesfgtt,would feel uncomfortable man waiting line s single person bathroom s risk d get funny looks situation would almost never happen woman would flip original poster said women would flip line men s bathroom man waiting women s line would holding line reason man could go bathroom zero line otherwise people would think s odd keep ask waiting women s line flip outs ,0.044
1198,eesvuoc,one reasons nt like idea gender neutral restrooms norm sounds nice s still every day people together potentially vulnerable sensitive place dickhead harass flash watch vice versa think could work smoothly places ,0.354
1199,eetc73i,went clean women s bathroom food service job discovered someone somehow managed apply shit ceiling mean respect hustler damn ,0.167
1200,eetzv8e,assumption new idea japan pretty much s done already quite common single toilet used everyone common menswomen s combined usually sit toilet change facilities paired men s toilet equipped urinal save space necessity invention new idea controversial works brilliantly ,-0.042
1201,eeu0dr5,mean unisex gender neutral stupid term ,0.319
1202,eeu3f5p,m way late remember making small talk topic waiting line single toilet restroom men s one nt even urinal unintentionally ended convincing guy talking head women s toilet since nt line ,-0.188
1203,eeu9gu2,went place gender neutral bathroom men bathroom beside ,-0.146
1204,eeu9ma0,think could simply boil restaurant poll customers could fill brief card come asking would want bathroom available instead genderneutral know majority say want way m saying s rightmoral m saying something like customers disagreementupset something like could affect store s business ,0.021
1205,eeu9pz3,hate baby jesus much ,0.167
1206,eeuam3p,japan space limited wherever go cafes restaurants often single stall restroom women another single stall one men women mark neutral one usually smaller napkin disposals basket w extra napkins many japanese restaurants ladies w emergencies works well since ladies tend longer natural reasons could always use extra stall ,-0.125
1207,eeucsnd,s law live s socal ,-0.562
1208,eeudd1m, gone lot places gender neutral say restroom one counter point would simply hygiene man know many us shit aim peeing would suck women clean seat sitting ,0.208
1209,eeuegei,space differences dont allow,-0.542
1210,eeuer43,people looking permission take shit door lock one toilet bathroom think little sign stopping people shitting pants guess shit ,0.583
1211,eeues5x,ll change view even restrooms labelled gender gender segregation antiquated practice time believed seeing woman s ankle immodesty s re adults s reason man ca nt handle washing hands sink woman vice versa,-0.021
1212,eeug0an,makes sense however would want happen queue women s toilet way longer line men s one ,-0.208
1213,eeuimz7,sorry women nt get trash male bathroom kidding someone worked retail awhile female bathroom almost always seems dirty males ,0.208
1214,eeunroq,changing view right use single men room available need especially pregnant would often work door locks anyway always garbage whatever need toss go toilet ,0.062
1215,eeusg0j,unisex bathrooms quite specialty unisex bathrooms small store like mcdonalds subway would smarter telling people wait specific bathroom furthermore specialty items gender uses hygiene disposal stations urinals affect gender long s used correctly unisex bathrooms also gone name family bathrooms gender neutral yes single toilet considered unisex women throw tamponspads trash could smell putting specialty disposal box nt know box cause m guy ,0.312
1216,eev0rw7,edit referring multiuser gender neutral restrooms ,-0.152
1217,eew4jcc,dr office one gender neutral bathroom issue older gentleman used bathroom could cleaned every single use men s room ve used gross would nt used could wait ,-0.083
1219,efh41vg,first gender neutral bathroom laws applied south call one holers bathrooms used one person time ,-0.104
