,comment_id,body,score
0,cza1q49, difference average earnings men women explained taking account relevant factors nt myth feel explain ,-0.083
1,cza1wdh,myth gap entirely based sex person ,-0.022
3,cza2bw8,assertion women get paid less jobs get paid less women ,-0.146
4,cza2iji,said op s re measuring re measuring aggregate entertainers women make less nt jlaw complaining ,-0.083
5,cza2jj3, men women payed less job nt think many people say case though think misconception side something feminists said even women lower average wage jobs men mean s even bigger individual cases shows women inferior position woman get literally cents less averages show bigger picture edit changed ,-0.042
6,cza31e2, wage gap average total men s pay vs total women s pay believe s sure admit exists people refer pay gap referring time d say time people think re talking discrimination true actually say s discrimination essentially critics assuming saying something saying ,-0.021
11,cza37ue, point nt talking discrimination ,-0.174
13,cza392y,women paid less job ,-0.229
16,cza3m1b,obviously nt make sense women nt want earn money conflicts know humankind people men women generally want make money generally nt okay given less people given women whole nt less interested money men something must going ,0.0
17,cza3r5u,think hollywood professional sports big exception salaries two industries virtually cap often nt tied quality work quantity work re subjective star power ,0.098
20,cza47sd, nt think many people say case though think misconception side something feminists said president obama hilary clinton say time every time mention discrepancy earnings always women deserve equal pay equal work ,-0.083
21,cza47xu,nt think re different truest form perceived value scarcity skill s difference wnba nba many factors could keep wages low woman instance wife took maternity leave weeks boss would hound missing son future plans son boss never asked going take time etc supposition wife going quit wife chose year boss finally let wife quit somehow would used say women keep wages low ignoring women often go child rearing ,-0.062
23,cza4d2a, women whole nt less interested money men source mine anecdotal experience factors money schedules flexibility time work condition work enjoyability etc much important women men ,-0.062
24,cza4gsv,gist post make sense conflicts thinkknow humankind source train thought ,-0.021
25,cza4ldq,biological differences explain trends ve seen cs female enrollment cs tracked alongside technical fields suddenly reversed dropped dramatically difference biology going either dramatic change women s biology since dramatic change cs technical fields since matched women s biology really suspect ideas imo ,-0.083
27,cza5maz, s difference wnba nba m saying nt another worms entirely ve heard primarily skill level players games less exciting stakes lower feeds back ,-0.188
28,cza6q74, fact matter unless want strip young women agency force high paying fields restrict family really nothing done difference average earnings mainly nt problem discrimination involved nt true another way reduce differnce instead stripping agency young women away could strip agency young men away could force low paying fields force take extra time work whenever female coworker kid ,0.083
29,cza6wrd,well wife quit order full time mother nt exactly mean chose make less therefore bring aggregate wage women repeated fact women generally go child rearing nt see relevant free quit job stay home dad let wife continue career inherent reason women continue primary caregivers nt see parent given special consideration employer paid offered promotions kids chose spend less effort time work ,-0.104
31,cza76eq,women spent years told value human beings tied money bring would honestly surprise lot women cared much pay men ,0.188
32,cza79u4,nt also mean husband choose wife earn less husband wife want stay home parent decide together mutual agreement wife quit job choice woman earn less rests equally man woman situation ca nt say s women making choices men contribute choices well ,0.175
33,cza7gpu,believe socialization plays huge role people s choices acknowledge past women nt socialized career focused men seems like d understand explanations wage gap exists justifications stems outdated gender roles conditioning eradicated ,0.0
34,cza8437,absolutely socialization monolith women discouraged lucrative careers men willing sacrifice careers judged harshly goes socialization re extremely different explanations nt think s anyone outside small minority argues socialization plays role ,0.042
35,cza882y,op arguing least s problem ,-0.354
36,cza8lst, op arguing difference incomes due discrimination probably completely true mostly true maybe th difference discrimination ,-0.042
37,cza8rfm,maybe could something recent trend feminists saying computer science sexist would want join profession would treat less even sexism perception could keep people away ,0.417
38,cza8whl,agree biological difference ,-0.417
39,cza910x, possible new developments particular fields led women away tell d need see massive shift field explain parents software engineers m cs phd opinion sea change s terms actual work done computer scientists software engineers justifies massive change trends among women cs right stats gave necessarily indicate sexism indicate men women different justification extremely loose even women nt discouraged intentional sexism culture still play big role lot people feel cultural forces problem ,-0.042
40,cza9u51,culture exclusion many higher paying fields like tech science wherein women nt feel like belong equals etc men elect enter another field experiencing directly whereas others opt never enter fields first place take lesser paying jobs sociological forces play point also burden children something nt neglect sorts reasons child came unplanned life something detrimental impact potential job earnings count total number caloric hours labor undertaken men women women work percent per week men average yes child care home making labor albeit unpaid ,-0.109
41,czaacrg,s commonly happens s getting better still work ,-0.458
42,czabx13,work needs done exactly believe point contention say need advocate cultural shifts agree hard really purview government want specific government action specifically would another equal pay law nt going solve anything ,0.083
43,czaeclj, nt also mean husband choose wife earn less husband wife want stay home parent decide together mutual agreement wife quit job choice woman earn less rests equally man woman situation generally couples opt one partner stay home care kids daycare expensive babies year expensive make year s basically takehome taxes unless partners high wage earners usually makes economic sense one stay home one wants work fulltime job pay someone else take care child ,0.083
44,czagngx,make fact many countries much lower aggregate wage gaps us biologically different women possible cultural reasons countries end less wage inequality aggregate us ,0.292
45,czam31j,would reason feminists call sexist unless already difference s pick field random start painting signs ,-0.104
46,czatwk3,nt know would say s completely biological nt know enough differences brains s definitely socialization ve heard country vast majority cs people women ca nt remember ,-0.104
47,czjeljo,lack actual existence take scientific method heart currently way actual prove existence therefore god exist ,0.104
48,czjenf6,anything prove existence logically exist ,-0.125
49,czjep9r,yeah think anything proven scientific method believe would argument ,-0.146
50,czjeqwm,sure god may exist simply zero evidence existence supreme thus claim must exist bit far fetched zero evidence invisible dragon flying computer right thus claim dragon based evidence nt exist either ,0.188
51,czjevym,restate think saying opposite intended ,-0.042
52,czjew3p, think anything proven scientific method believe would go proving claim apparently believe scientific method measure belief show believing thing scientifically show existence crossed hurdles determine beliefs scientifically provable even possible people infinite number beliefs confirm scientifically infinite beliefs scientifically provable ,-0.188
53,czjex5r,six arguments believe make existence god likely far six well known committing god gaps fallacy saying strong deductive arguments existence god none arguments gave end nt know therefore god ,-0.021
54,czjf1kj,affirmative evidence god simply showing great deal conformation bias stripped bible existence would still believe judeochristian god saying x arguments mean god possible nt mean god know exist means possible ,0.191
55,czjf4e2,post listed several arguments existence god arguments gave also end therefore god possible end variants therefore god exists accept premises conclusion necessarily follows may seem obvious kalam parsed leads powerful immaterial personal cause exists outside time space argument resurrection uses bible nt assume bible word god even accurate use treat historical document use principals found bayesian probability theory make case likely explanation ,0.167
56,czjf6jq, currently way actual prove existence therefore god exist nt seem take scientific method heart much ,-0.062
57,czjf9es,difference belief actual existence people believe purple bunnies mean exist scientific method talks setting observation testing concluding hypothesis correct everything know exists proven beliefs different know everything believe correct knowing remove word believe makes confusing know isnt real prove ,-0.043
58,czjfc9s,make affirmative claim like god exists small problem showing evidence claim none starting conclusion already mind matching things meet conclusion means swimming confirmation bias keeping like getting rid nt mean final conclusion make claims want useless without evidence ca nt see anything prove god prove invisible flying dragon made believe want believe deeply nt proven anything since nt evidence ,0.25
59,czjg2mx, scientifically test existence god claim propose test ,0.021
60,czjg3r8,gave multiple arguments existence god question reason believe god exist ,-0.125
61,czjg5d8,put scientific method test ,-0.681
62,czjg836,arguments existence god evidence understand correct ,-0.043
63,czjg9g7,evidence used premise syllogism men mortal socrates man therefore socrates mortal evidence evidence men mortal socrates man would used reach conclusion socrates mortal ,-0.261
64,czjgxgu,m person re responding said order rational discourse presuppositions made concerning nature reality two come mind reality exists senses giving us reliable view reality employ information provided senses understand reality survive scientific method extention way deny question start questioning perception reality makes rational discourse impossible ,-0.146
65,czjhr7r,materialistic view expressed natural selection directly bring senses question reason leads us natural selection natural selection leads back lack confidence reason view selfdestructs ,-0.106
66,czjhwkq, way deny question start questioning perception reality makes rational discourse impossible descartes would disagree scientific method inductive reasoning rule still left deductive reasoning rational discourse entirely possible limited deduction fact given noncircular argument induction one might argue inductive reasoning inherently irrational ,0.022
67,czjjjyo,s perfectly valid criticism make would argue going route renders entire argument meaningless re going question ability perceive reality ca nt justify knowledge beliefs concerning reality reasonable suspect one s senses purpose philosophical debate nt really meaningful outside context reality rely senses survive employ form scientific method order ,-0.085
68,czjjwfs,trying come test proves existence god good luck ,-0.087
69,czjmxqf,would argument directly nonexistence something unfalsifiable even work something d expect see even knew sure god posit countless hypothetical entities defined way d impossible disprove directly regardless whether exist talking god take given argument going counterargument argument god ,0.021
70,czjod9c,easiest far argument existence god reverse notrue scotsman since definition whatwho god completely subjective open matter proof show dismissed meant different kind god insert special quality even god show personally ama could dismiss himherit actual god kind absolute cosmic creator surely creator ,0.104
71,czjox1l,alright first need define kind god referring omnipotent omniscient god type simple reason exist unable properly verify omnipotence thus capable acknowledging thus god exist,0.021
72,czjsnbb,well claim god exists put claim test say heal x z set experiement hast chance say seeing set test see true course find way communicate ,0.083
73,czjt4jk, define god greatest conceivable actually proof god nt exist prove sheer power numbers greatest implies sense quantity posited might call god took infinite amount space one possible value greatest conceive larger infinity could fill thus making god fall short standard anything quantifiable conceive something larger actually exists adding re arguing god say fall short nature infinities infinite number infinities infinities larger infinities ,0.042
74,czju33f, currently way actual prove existence therefore god exist statement shows failure understand scientific method according scientific method order say x exist x must falsified order something exist according science must tested disprovedthe existence god proven falsified statement nonscientific reasoning would make sense say therfore reason believe m convinced claim god exist negative truth claim must supported falsification positive version claim ,0.292
75,czjvjmu,said re capable willing defend arguments ll start two simple questions reason believe objective moral values exist ve never theist answer question anything appeal emotion popularity ridicule moral relativism place one possibly take resurrection event anything nearzero probability bayesian analysis without first already arguing god exists therefore miracles happen thus making circular argument ,0.104
76,czjxluw,thought theists usually argue infinites ca nt actually exist wonder works,-0.167
77,czjyb2p,using add argument prove infinities exist well case ,0.043
78,czk32ie,rational atheist argues conclusively prove god onus see fsm etc post relies strawman m going try change view view practically one actually holds ,-0.062
79,czkdcdj,nt ask conclusive proof notice question asked argument single argument make strawman claimed atheism unable provide argument claim god exist ,0.062
80,czkdrpn,man asking great questions honestly willing dialogue would happy answer anything bring forward would remind week would happy talk honestly appreciate critique m asking original question sincerely feel keep attention least short time attempted responses ,-0.087
81,czke3gd,atheism assert god nt exist ,-0.109
82,czkeo2t,several problems defined god greatest conceivable saying inability properly verify existence something argument existence properly verify specific person tribe exists therefore conclude person tribe ever existed discovery neutrino could conclude neutrinos exist observe humans special place perspective arbiters truth whereby human able perceive something therefore exist omnipotent means ability bring state affairs logically possible one situation bring ,-0.042
83,czkerw6,defined meant god original post claiming argument something existence alternative definitions d interested would willing actually defend assertion ,-0.043
84,czkf8h3,honestly new atheist definition atheism lack belief god completely untenable philosophers simply nt use leads absurdities wrong always true true along theism ,0.062
85,czkfge3,ll probably forget know remind thing works feel free tag comment continue discussion,-0.5
86,czkg9kn,m making straw man m going base argument assuming atheists make argument nt make know straw man argument actually ,0.159
87,czkm11n,s new atheism definition s literally word atheism means nt matter untenable find s literally people disagree believe get job would lot easier atheists would believe defend simple argument want part nt atheists lack belief god want refute belief onus prove god appeal authority philosophers reject changes ,0.043
88,czkp7l8,nt debating psychological states debating truth claims according definition atheism left foot atheist dog atheist definition true regardless whether god exists psychological state definition atheism theism true utterly useless ,0.042
89,czksdqe,thats thing defined mean god agreed upon intersubjective definition idea god objectively undefendable matter much proof show contrary unless agree looking makes much sense trying prove existence beauty fairness ca nt prove something fundamentally undefined something unprovable exist maningful way ,0.042
90,czksh0n, thats thing defined mean god agreed upon intersubjective definition someone else comes another definition science definitions science longer discussed debated idea god objectively undefendable matter much proof show contrary unless agree looking make claim plausible god according definition gave exists debating people s definitions god saying everyone agrees definition ,-0.062
91,czkug3t,god construct impossible prove disprove since s considered exist mortal world unless something unexplainable happens handy way keep god image alive always people doubting either side gods existence kind similar way said cat next right may may believe end wo nt impact current life discussions around would popular subject talk following fact would meaningless trying argue exists s quite stretch god captures point wanted make ,0.125
92,czkuvie, science idea process nobody claims science physically existing entity science exist happens god definition define god greatest conceivable idea greatness ontologically meaningless unless mean sheer size goes attributes god good ultimate truth ultimate prefection allknowing etc qualities purely subjective make sense objective reality outside human perception question greatest conceivable exists answer obviously question nonsensical tldr ca nt claim god s existence unless definition god finite nonparadoxical illogical beings exist ,0.042
93,czlpdpo, science idea process nobody claims science physically existing entity science exist happens sorry think nt clarify objection sufficiently said order discuss god would need definition agreed upon intersubjective definition asking true science going commit fallacy special pleading science idea greatness ontologically meaningless unless mean sheer size goes attributes god good ultimate truth ultimate prefection allknowing etc philosophy generally agreed upon certain greatmaking properties knowledge eternality power actualize states affairs ones believe easily defended ,-0.083
94,czlqe97,think accurate several well many arguments existence god given six ask proof asked argument distinct difference prove multiverse false offer arguments ,-0.062
95,czyj0ip,maybe dogs yeah wolves vastly underrated re like lions dog world absolutely powerful massive people confuse smallish size medium sized dogs re probably bigger biggest dog would almost definitely end fucked body end fight dogs ,0.271
96,czyj0vd,think dogs dangerous bite claw humans abilities mentioned also faster gives another bonus us finally dogs moral conscience dog attacking bad situation fight back dog acknowledge keep attacking leaving chance winning fight ,0.083
97,czyj2gs,small bone crushing knives strike multiple times even react last place bit speed force re dogswolves armed incredibly powerful weapons hand paw disadvantage ,0.104
98,czyj2rq,dogs incredibly sharp teeth set incredibly strong jaws s smaller dog d probably fine bigger dog stronger faster even re strong fast might able win end re going get fucked process people videos taken surprise often young fit males ,-0.043
99,czyj9vs,believe victory survive dog fight lose appendages infection ,-0.167
100,czyja5h,sure might win re going get fucked ,0.375
101,czyjfsw,re lumping different animals ever even seen coyote re relatively small s reason scavenge hunt packs unless backed corner going run away wolves hand outweigh small adult much speed strength potent natural weapons dogs span whole spectrum sizesshapes depending breed nt think anyone doubt could dropkick chihuahua mastiff outweighs stands tall chest ,0.042
102,czyjhfs,anyone thinks take wolf deluding ,-0.167
103,czyjhqz,wolf trained life kill things bite wolf s throat would hesitate little bit m going go limb say hesitate dog wo nt delay dog wo nt dog inch knives bring fight ca nt also idea neck attacked ever trained go would significant disadvantage dog wanted kill ,0.149
104,czyjufm,biggest dogs lbs big wolves ,-0.5
105,czyk71o,wolves lbs largest domesticated dogs said s lb dog raised either kill killed scenarios lb dog likes lap ,-0.167
106,czykgjk, wolves hand outweigh small adult much speed strength potent natural weapons wolves also really well developed team tactics s solid chance would nt even dealing one wolf ,-0.217
107,czykuef,coyotes wolves pack hunters unlikely would come across one dogs coyotes wolves fangs claws always go weakest part get one bite hold super strong jaws shake matter speedy faster way large stick could help throw ,-0.447
108,czyl1me,dog s teeth inches long ,-0.426
109,czylher,re going bite something hard present arm sacrifice proceed snap neck might win however losing arm destroyed bonestendons count win ,0.042
110,czylnxj,guess m minority op lbs ve always figured long avoided panic stayed aggressive could come top faced hundred pound dog lb dogs would probably lot harder pack whole different story yea know jaws stamina dense muscles still throat weak spots punch hard bite s balls fake throw tennis ball ,0.043
111,czylpg3,obviously m looking test theory real life m pretty awesome daydreams ,-0.468
112,czylsux,trained german shepherds schutzhund could go speed ferocity cliffs notes would get wrecked example friend put arm pad super gentle female lb gsd run yard head start throw ground like bitch starting middle line backer high school team ended playing college ,0.167
113,czylxms, ve always figured long avoided panic stayed aggressive experience avoiding panic life death situations ,-0.042
114,czym2i2,would really matter shared story one time whose ever believed online comment describing someone s amazingness ,-0.021
115,czym3jp,think get saying though keeping cool big obstacle,-0.312
116,czym6go,used feel way heard wolves hunting chilling ran like mile,-0.25
117,czym6qx,mean m particularly invested came navy seal copypasta sounding story likely would nt believe s find lot people take granted ability handle panic situations well ve bunch sometimes handled really well times broke lost shit shut walked away fugue hell thing man nt know could count context ,0.109
118,czymfdo,wo nt argue bit based history think know would react similar scenario one described keyword think depends situation faced pack wolves bear d say odds shitting passing fear would pretty good maybe id turn superman maybe poodle would make shit ,0.375
119,czymhta,yeah never really know like said s hell thing ,-0.125
120,czymiof,well one way really find ,-0.479
121,czymrir,know op way really change view challenge beliefs think go wild dog fight lose view successfully changed ,-0.13
122,czyn19g, inches inches nt really matter wolves teeth claws designed kill simply would overmatched ,-0.375
123,czyn1xq,s need exaggerate make point ,-0.417
124,czyn4e0,really nt much exaggeration claws teeth massive amount bite force per square inch means would probably lose facing one animal ,-0.106
125,czynvr6,world record wolf killed alberta lbs wolf bigger average american man daggers teeth run mph makes ray lewis look like baby back bitch still think fight bare handed ,0.271
126,czynz7h,goes humans also climb trees,-0.5
127,czyo38c,weirdly enough think fairly frequently would hesitate use weak ass mouth rip throat animal human aggressor life depended ,0.435
128,czyo3au,guess depends attacked attacked building might huge advantages locking doors getting weapons etc somewhere climb vertically keep kicking tries climb throw items flat ground though without good weapon wolf would kill people ,0.229
129,czyo9rg,dog coyote yes wolf pack large dogs pack coyote pack wolfs hell,-0.022
130,czyoaog,would seriously fight bear one took leo revenant id smash mofo,0.062
131,czyofn2,believe given op point valid moot given parameters ,-0.375
132,czyoi3e,weapons significant weaknesses well first thing comes mind dogs front legs nt bend sideways well pretty thin could easily strength break legs one swift movement also way cover eyes vulnerable target well preoccupied biting leg could go straight eyes serious damage potentially enough put action immediately m saying weaknesses would easy exploit means guarantee win thought d provide counterpoint dangerous weapons ,0.125
133,czyojni,yes alive wolf,-0.362
134,czyomg6,still inches inch long canine teeth get older shorter teeth ,-0.438
135,czyp7ct,also would nt fighting back trying hurt dog people survived wolfbearcoyoteyou name attacks many many times op standing chance anywhere near realm possibility,-0.146
136,czyp7x9,problem wolfs generally hunt packs even got one would team,-0.542
137,czypctm, people videos taken surprise often young fit males animals go easy targets young fit male easy target even win chances considering s normally many vs get injured easily die ,0.167
138,czypi01,s flexible wolves though spine neck guys easily lick buttholes get good grip leg think upper hand suddenly fingers longer exist goes basically advantage ,0.196
